{
  "schema_version": "apg.maturity-ledger/v1",
  "release": "v0.11",
  "owner_phase": "APG139",
  "skills": [
    {
      "skill_id": "agentic-praxis-grimoire-workflow",
      "path": "skills/agentic-praxis-grimoire-workflow/SKILL.md",
      "current_maturity": "stable",
      "blocking_debts": [],
      "source_references": [
        "skills/agentic-praxis-grimoire-workflow/SKILL.md",
        "skills/README.md",
        "docs/provenance.md",
        "docs/skill-authoring-and-maintenance.md"
      ],
      "required_evidence_categories": [
        "repeated_positive_use",
        "representative_non_triggers",
        "defect_debt_disposition",
        "rollback",
        "provenance",
        "independent_review",
        "current_validation"
      ],
      "evidence": {
        "repeated_positive_use": [],
        "representative_non_triggers": [],
        "defect_debt_disposition": [],
        "rollback": [],
        "provenance": [],
        "independent_review": [],
        "current_validation": []
      },
      "independent_review": null,
      "next_lifecycle_trigger": "Individual agentic-praxis-grimoire-workflow review when repeated-use and non-trigger evidence is available under the maintained skill lifecycle; reassess named debt if its exact condition changes.",
      "disposition_status": "EXISTING_STABLE",
      "maintenance_ref": null,
      "debt_authority": "docs/governance/language-profile-known-debt.json",
      "active_debts": [],
      "resolved_debts": []
    },
    {
      "skill_id": "astro-profile",
      "path": "skills/astro-profile/SKILL.md",
      "current_maturity": "provisional",
      "blocking_debts": [],
      "source_references": [
        "skills/astro-profile/SKILL.md",
        "skills/README.md",
        "docs/provenance.md",
        "docs/skill-authoring-and-maintenance.md",
        "docs/governance/maturity/apg139/astro-profile.json"
      ],
      "required_evidence_categories": [
        "repeated_positive_use",
        "representative_non_triggers",
        "defect_debt_disposition",
        "rollback",
        "provenance",
        "independent_review",
        "current_validation"
      ],
      "evidence": {
        "repeated_positive_use": [
          "docs/governance/maturity/apg139/astro-profile.json"
        ],
        "representative_non_triggers": [
          "docs/governance/maturity/apg139/astro-profile.json"
        ],
        "defect_debt_disposition": [
          "docs/governance/maturity/apg139/astro-profile.json"
        ],
        "rollback": [
          "docs/governance/maturity/apg139/astro-profile.json"
        ],
        "provenance": [
          "docs/governance/maturity/apg139/astro-profile.json"
        ],
        "independent_review": [
          "docs/governance/maturity/apg139/independent-review.md"
        ],
        "current_validation": [
          "docs/governance/maturity/apg139/astro-profile.json",
          "docs/governance/maturity/apg139/qualification.md"
        ]
      },
      "independent_review": "docs/governance/maturity/apg139/independent-review.md",
      "next_lifecycle_trigger": "Supply actual Astro execution-boundary and client-directive/content-adapter guidance-use receipts across materially distinct tasks, including a non-trigger handoff to the relevant JSX, React or browser owner; bind compiler and adapter context and obtain current independent validation.",
      "disposition_status": "PROVISIONAL_MAINTENANCE",
      "maintenance_ref": "MATURITY:astro-profile",
      "debt_authority": "docs/governance/language-profile-known-debt.json",
      "active_debts": [],
      "resolved_debts": []
    },
    {
      "skill_id": "bash-language-profile",
      "path": "skills/bash-language-profile/SKILL.md",
      "current_maturity": "stable",
      "blocking_debts": [],
      "source_references": [
        "skills/bash-language-profile/SKILL.md",
        "skills/README.md",
        "docs/provenance.md",
        "docs/skill-authoring-and-maintenance.md"
      ],
      "required_evidence_categories": [
        "repeated_positive_use",
        "representative_non_triggers",
        "defect_debt_disposition",
        "rollback",
        "provenance",
        "independent_review",
        "current_validation"
      ],
      "evidence": {
        "repeated_positive_use": [],
        "representative_non_triggers": [],
        "defect_debt_disposition": [],
        "rollback": [],
        "provenance": [],
        "independent_review": [],
        "current_validation": []
      },
      "independent_review": null,
      "next_lifecycle_trigger": "Individual bash-language-profile review when repeated-use and non-trigger evidence is available under the maintained skill lifecycle; reassess named debt if its exact condition changes.",
      "disposition_status": "EXISTING_STABLE",
      "maintenance_ref": null,
      "debt_authority": "docs/governance/language-profile-known-debt.json",
      "active_debts": [],
      "resolved_debts": []
    },
    {
      "skill_id": "bats-test-profile",
      "path": "skills/bats-test-profile/SKILL.md",
      "current_maturity": "stable",
      "blocking_debts": [],
      "source_references": [
        "skills/bats-test-profile/SKILL.md",
        "skills/README.md",
        "docs/provenance.md",
        "docs/skill-authoring-and-maintenance.md"
      ],
      "required_evidence_categories": [
        "repeated_positive_use",
        "representative_non_triggers",
        "defect_debt_disposition",
        "rollback",
        "provenance",
        "independent_review",
        "current_validation"
      ],
      "evidence": {
        "repeated_positive_use": [],
        "representative_non_triggers": [],
        "defect_debt_disposition": [],
        "rollback": [],
        "provenance": [],
        "independent_review": [],
        "current_validation": []
      },
      "independent_review": null,
      "next_lifecycle_trigger": "Individual bats-test-profile review when repeated-use and non-trigger evidence is available under the maintained skill lifecycle; reassess named debt if its exact condition changes.",
      "disposition_status": "EXISTING_STABLE",
      "maintenance_ref": null,
      "debt_authority": "docs/governance/language-profile-known-debt.json",
      "active_debts": [],
      "resolved_debts": []
    },
    {
      "skill_id": "browser-runtime-profile",
      "path": "skills/browser-runtime-profile/SKILL.md",
      "current_maturity": "provisional",
      "blocking_debts": [],
      "source_references": [
        "skills/browser-runtime-profile/SKILL.md",
        "skills/README.md",
        "docs/provenance.md",
        "docs/skill-authoring-and-maintenance.md",
        "docs/governance/maturity/apg139/browser-runtime-profile.json"
      ],
      "required_evidence_categories": [
        "repeated_positive_use",
        "representative_non_triggers",
        "defect_debt_disposition",
        "rollback",
        "provenance",
        "independent_review",
        "current_validation"
      ],
      "evidence": {
        "repeated_positive_use": [
          "docs/governance/maturity/apg139/browser-runtime-profile.json"
        ],
        "representative_non_triggers": [
          "docs/governance/maturity/apg139/browser-runtime-profile.json"
        ],
        "defect_debt_disposition": [
          "docs/governance/maturity/apg139/browser-runtime-profile.json"
        ],
        "rollback": [
          "docs/governance/maturity/apg139/browser-runtime-profile.json"
        ],
        "provenance": [
          "docs/governance/maturity/apg139/browser-runtime-profile.json"
        ],
        "independent_review": [
          "docs/governance/maturity/apg139/independent-review.md"
        ],
        "current_validation": [
          "docs/governance/maturity/apg139/browser-runtime-profile.json",
          "docs/governance/maturity/apg139/qualification.md"
        ]
      },
      "independent_review": "docs/governance/maturity/apg139/independent-review.md",
      "next_lifecycle_trigger": "Supply repeated actual browser-host guidance decisions bound to engine, version, platform, origin and context with executed host predicates, plus a language-only non-trigger and explicit WebView/assistive-technology limits for independent review.",
      "disposition_status": "PROVISIONAL_MAINTENANCE",
      "maintenance_ref": "MATURITY:browser-runtime-profile",
      "debt_authority": "docs/governance/language-profile-known-debt.json",
      "active_debts": [],
      "resolved_debts": []
    },
    {
      "skill_id": "chatgpt-manager-workflow",
      "path": "skills/chatgpt/chatgpt-manager-workflow/SKILL.md",
      "current_maturity": "provisional",
      "blocking_debts": [],
      "source_references": [
        "skills/chatgpt/chatgpt-manager-workflow/SKILL.md",
        "skills/README.md",
        "docs/provenance.md",
        "docs/skill-authoring-and-maintenance.md",
        "docs/governance/maturity/apg139/chatgpt-manager-workflow.json"
      ],
      "required_evidence_categories": [
        "repeated_positive_use",
        "representative_non_triggers",
        "defect_debt_disposition",
        "rollback",
        "provenance",
        "independent_review",
        "current_validation"
      ],
      "evidence": {
        "repeated_positive_use": [
          "docs/governance/maturity/apg139/chatgpt-manager-workflow.json"
        ],
        "representative_non_triggers": [
          "docs/governance/maturity/apg139/chatgpt-manager-workflow.json"
        ],
        "defect_debt_disposition": [
          "docs/governance/maturity/apg139/chatgpt-manager-workflow.json"
        ],
        "rollback": [
          "docs/governance/maturity/apg139/chatgpt-manager-workflow.json"
        ],
        "provenance": [
          "docs/governance/maturity/apg139/chatgpt-manager-workflow.json"
        ],
        "independent_review": [
          "docs/governance/maturity/apg139/independent-review.md"
        ],